[
  {
    "kind": "movie",
    "title": "Spirited Away",
    "original_title": "千と千尋の神隠し",
    "creators": ["Hayao Miyazaki"],
    "release_date": "2001-07-20",
    "language": "ja",
    "series": "Studio Ghibli Collection",
    "series_index": 12,
    "labels": ["anime", "fantasy", "favorite", "classic"],
    "description": "During her family's move to the suburbs, a sullen 10-year-old girl wanders into a world ruled by gods, witches, and spirits, and where humans are changed into beasts.",
    "imdb_id": "tt0245429",
    "external_url": "https://www.imdb.com/title/tt0245429/",
    "image_url": "https://images.unsplash.com/photo-1534447677768-be436bb09401?w=600&auto=format&fit=crop&q=80"
  },
  {
    "kind": "movie",
    "title": "Blade Runner 2049",
    "original_title": "Blade Runner 2049",
    "creators": ["Denis Villeneuve"],
    "release_date": "2017-10-06",
    "language": "en",
    "series": "Blade Runner",
    "series_index": 2,
    "labels": ["sci-fi", "cyberpunk", "neo-noir", "favorite"],
    "description": "Young Blade Runner K's discovery of a long-buried secret leads him to track down former Blade Runner Rick Deckard, who's been missing for thirty years.",
    "imdb_id": "tt1856101",
    "external_url": "https://www.imdb.com/title/tt1856101/",
    "image_url": "https://images.unsplash.com/photo-1518709268805-4e9042af9f23?w=600&auto=format&fit=crop&q=80"
  },
  {
    "kind": "book",
    "title": "Dune",
    "original_title": "Dune",
    "creators": ["Frank Herbert"],
    "release_date": "1965-08-01",
    "language": "en",
    "series": "Dune Chronicles",
    "series_index": 1,
    "labels": ["sci-fi", "space-opera", "classic", "favorite"],
    "description": "Set on the desert planet Arrakis, Dune is the story of the boy Paul Atreides, heir to a noble family tasked with ruling an inhospitable world where the only thing of value is the 'spice' melange.",
    "isbn": "9780441172719",
    "openlibrary_id": "OL893415W",
    "external_url": "https://openlibrary.org/works/OL893415W",
    "image_url": "https://images.unsplash.com/photo-1509316975850-ff9c5deb0cd9?w=600&auto=format&fit=crop&q=80"
  },
  {
    "kind": "book",
    "title": "Dune Messiah",
    "original_title": "Dune Messiah",
    "creators": ["Frank Herbert"],
    "release_date": "1969-07-01",
    "language": "en",
    "series": "Dune Chronicles",
    "series_index": 2,
    "labels": ["sci-fi", "space-opera"],
    "description": "Twelve years after the events of Dune, Paul Atreides is Emperor of the Known Universe, facing the political and religious fallout of his jihad.",
    "isbn": "9780441172696",
    "openlibrary_id": "OL893416W",
    "external_url": "https://openlibrary.org/works/OL893416W"
  },
  {
    "kind": "movie",
    "title": "Princess Mononoke",
    "original_title": "もののけ姫",
    "creators": ["Hayao Miyazaki"],
    "release_date": "1997-07-12",
    "language": "ja",
    "series": "Studio Ghibli Collection",
    "series_index": 10,
    "labels": ["anime", "fantasy", "nature"],
    "description": "On a journey to find the cure for a Tatarigami's curse, Ashitaka finds himself in the middle of a war between the forest gods and Tatara, a mining colony.",
    "imdb_id": "tt0119698",
    "external_url": "https://www.imdb.com/title/tt0119698/",
    "image_url": "https://images.unsplash.com/photo-1511497584788-87676104235f?w=600&auto=format&fit=crop&q=80"
  },
  {
    "kind": "book",
    "title": "Neuromancer",
    "original_title": "Neuromancer",
    "creators": ["William Gibson"],
    "release_date": "1984-07-01",
    "language": "en",
    "series": "Sprawl Trilogy",
    "series_index": 1,
    "labels": ["cyberpunk", "sci-fi", "classic"],
    "description": "A washed-up computer hacker is hired by a mysterious employer to pull off the ultimate cyberspace hack.",
    "isbn": "9780441569595",
    "openlibrary_id": "OL245952W",
    "external_url": "https://openlibrary.org/works/OL245952W",
    "image_url": "https://images.unsplash.com/photo-1526374965328-7f61d4dc18c5?w=600&auto=format&fit=crop&q=80"
  },
  {
    "kind": "book",
    "title": "Count Zero",
    "original_title": "Count Zero",
    "creators": ["William Gibson"],
    "release_date": "1986-03-01",
    "language": "en",
    "series": "Sprawl Trilogy",
    "series_index": 2,
    "labels": ["cyberpunk", "sci-fi"],
    "description": "Seven years after Neuromancer, strange things are happening in the Matrix, and corporate intrigue reaches new heights.",
    "isbn": "9780441013678",
    "openlibrary_id": "OL245953W",
    "external_url": "https://openlibrary.org/works/OL245953W"
  },
  {
    "kind": "movie",
    "title": "Parasite",
    "original_title": "기생충",
    "creators": ["Bong Joon-ho"],
    "release_date": "2019-05-30",
    "language": "ko",
    "labels": ["thriller", "drama", "oscar-winner", "favorite"],
    "description": "Greed and class discrimination threaten the newly formed symbiotic relationship between the wealthy Park family and the destitute Kim clan.",
    "imdb_id": "tt6751668",
    "external_url": "https://www.imdb.com/title/tt6751668/",
    "image_url": "https://images.unsplash.com/photo-1486406146926-c627a92ad1ab?w=600&auto=format&fit=crop&q=80"
  },
  {
    "kind": "book",
    "title": "The Left Hand of Darkness",
    "original_title": "The Left Hand of Darkness",
    "creators": ["Ursula K. Le Guin"],
    "release_date": "1969-03-01",
    "language": "en",
    "series": "Hainish Cycle",
    "series_index": 4,
    "labels": ["sci-fi", "masterpiece", "classic"],
    "description": "A human envoy is sent to Gethen, an icy planet whose inhabitants are ambisexual, to persuade them to join an expanding galactic federation.",
    "isbn": "9780441478125",
    "openlibrary_id": "OL25899W",
    "external_url": "https://openlibrary.org/works/OL25899W"
  },
  {
    "kind": "movie",
    "title": "Arrival",
    "original_title": "Arrival",
    "creators": ["Denis Villeneuve"],
    "release_date": "2016-11-11",
    "language": "en",
    "labels": ["sci-fi", "drama", "linguistics"],
    "description": "A linguist works with the military to communicate with alien lifeforms after twelve mysterious spacecraft appear around the world.",
    "imdb_id": "tt2543164",
    "external_url": "https://www.imdb.com/title/tt2543164/",
    "image_url": "https://images.unsplash.com/photo-1451187580459-43490279c0fa?w=600&auto=format&fit=crop&q=80"
  }
]
